quechua,spanish
warmakuna yanacha wasimanta sach´a sach´aman phawanku,los niños se apresuran desde la escuela hacia el bosque
"¡hakuchis ,  mink´arikusqayki chuwipi pukllayta !","¡vamos ,  te invitojugar canicas !"
qori t'ika hat'un t'antata rakirparin,flor de oro dividió un pan grande
"imatapas runa ruwaqtin ,  manan phiñachinqachus chayta suyanchu","cuando una persona hace algo ,  podría no esperar que lo hará sentir disgustado"
mana sasa ruwaykunaqa maynillanpin ruwakun,las cosas simples son siempre las más inusuales
may ashkha llamayuqmi chay runaqa kasqa,esa persona posee muchas llamas
runa allin sumaq kikinwan kananpaqqa ashkha allin ruwaykunan kan,hay muchos comportamientos que pueden hacer que una persona se sienta orgullosa de sí misma
"makinkurayku askha runakuna llallinakuranku ,  ichaqa pay qarquran kusikuyta ch´ulla kaypi mashkaspa","muchos hombres compitieron por su mano ,  pero ella los rechazó ,  buscando la felicidad en soledad"
qochapi raul waqashan,raúl está llorando en el lago
maypi karanki,¿ dónde has estado ?
mana allin uywasqallan hat'aqoqa kikillan sumaqllaña wiñarusqa,el bledo creció abundantemente sin cuidado alguno
saqesqay hinallan kashan,esto está tal como lo dejé
ninkun huk qella maqt'atas usa tukurapusqa,cuentan queun joven ocioso se lo comieron los piojos
noqa qoyllurta rikuni,veo una estrella
kukuchikuna runakunata manchachin,los fantasmas asustanla gente
payqa carcelpin kashan,él está en la cárcel
rakhu p'achaqa chirimanta kurkunchista hark'an,la ropa gruesa protege nuestro cuerpo del frío
qan chocolatita munanki,tú quieres chocolate
"qanrí ,   ¿ maymanta hamushanki ?",y tú  ¿ de dónde vienes ?
chay ruwayta mana chaskisqachu millaypunin chayqa consejo viceministro nisqakunamanta hamuq,despreció tal comportamientolo consideró indigno de un miembro del consejoun viceministro
"sichus llakisqa runata rikuni chayqa ,  kurpuypin nanayninta tarini","cuando veouna persona que sufre ,  siento su dolor en mi cuerpo"
t'antaq chaninta qawariy,observa el precio del pan
espinar llaqtamanta santo tomás llaqtamanqa bellilli llaqtallantapuni rinchis,de espinarsanto tomás siempre tendremos que ir por velille
nishu llakisqan kawsani,vivo muy afligido
chakra tarpunaykupaq raymichay,para la siembra hacemos fiesta
chay qhatata pukllananchispaq pampachasunchis,aplanemos esa ladera para jugar
sapallanmi chay runaqa waqtuta ukyarapusqa,esa persona sola se ha tomado toda la botella de cerveza
llapaykichis hamuychis,vengan todos
"¡wataq imaymana wiñayninkunata munawaq ,  aswanpas cheqaqpuni kan ,  samana killata llapan munanku !","¡puedes amar las diferentes temporadas del año ,  pero honestamente ,  todos aman las vacaciones !"
taytaypa makin llank'ananpaq,la mano de mi papá sirve para que trabaje
vacunakunaqa onqoymantan hark'awanchis,las vacunas nos protegen de las enĩermedades
pablopiwanmi hamusqa,había venido con pablo
kay pachapiqa tukuy imapas kuyunmi,"en este mundo ,  todo se mueve"
qosqomanta hamuni,vengo de cusco
kay sasachakuyta allinchay,resuelve el problema
mana qaywisqa lawa mankaqa tiyaruspa rupharunmanmi,la olla de mazamorra que no se remueve puede asentarsequemarse
noqapaqqa manan imapas qhepasqachu,para mí no quedó nada
"chhullimanta ,  ch´oqhumanta hampikunapaq allin",es bueno para curarse de la gripela tos
khallwakunaqa parananpaqmi phawaykachan,la aparición de las golondrinas anuncia la presencia de lluvias
waynapura p'itaypi llallinakunku,entre jovenes corriendo se ganan
k'anas runakunaqa ch'eqchi p'achayuq kanku,los pobladores de canas llevan ropa gris
thoqayniymi haya ima llakichá hap'iwanqa,tengo la saliva amarga͗ qué preocupaciones tendré
ñawinchaytan paqarin yachachisqayki,mañana te enseñoleer
llapanku tiyashanku,todos estan sentados
k'ankaq mana sarusqan wallpaq runtunqa manas chiwchinmanchu,el huevo de la gallina que no ha sido fecundada por el gallo no genera vida
nishu karu kasqa,era bastante lejos
rimasqaytam ch´uyanchasaq,lo que he dicho voyaclarar
imapas allillanmi kanqa,todo vaestar bien
hanaq pachaqa wichaypi kashan,el cielo está arriba
chaka tulluymi nanawan,me duele el ilíaco
inka awkikunaqa yachaysapataq kallpasapataq karanku,los auquis de la época de los incas fueron muy sabiosforzudos
inti raymi p'unchawqa ishkay chunka tawayuq inti raymi killatan raymichakun,dicen que la fiesta del sol se festejaba el día ϭ de junio
mana allin kawsaykuna kaqtinqa awkinchiskunata tapurikusunchis,frentelas fatalidades de la vida consultemosnuestros ancianos
waylluyqa allinmi,amar es bueno
noqaqa kiswar pampa ayllumanta kani,yo soy de la comunidad de kishuar pampa
ichhu pichanaqa tukurakapunmi,la escoba de paja se ha terminado
orqo patakunaqa phuyusqallapunin kashan,la cima de los cerros casi siempre está cubierta de neblina
mana allin theqtichina kan,hay una sartén malograda
qanpas hamunaykin,tú también debes de venir
"kawsayqa huk chocolati caja nisqahinan ,  manan hayk´aqpas imatachus tarinki chayta yachankichu","la vida es como una caja de chocolates ,  nunca sabes lo que obtendrás"
papa chakramanta lliw qorakunata orqosunchis,de la chacra de papas hay que deshierbar todas las malezas
pukllanaykiraykun hamunki,vienes porque quieres jugar
"ch´eqmiqa mayqin runaq kawsaynintapas tukurachinmanmi ,  mana huchayuq kaqtapas","un rumor puede acabar con la carrera de cualquiera ,  incluso si no es culpable"
ichaqa mamay huch'uylla,mi mamá es bajita no más
juicio tukunankaman carcelpi kamunqa,mientras dure el juicio ella estará en la cárcel
sichus runa mana ayllunwan unay kan chayqa manan allin runachu kan,el hombre que no pasa tiempo con su familia nunca será un verdadero hombre
alqolla llapan kisuta mikhurqakapusqa,el perro se había comido todo el queso
"allin ruwayqa mati unupi mishk´ihinan; pisi kaqtinpas ,  llapan mishk´imanmi tukuchin","la esperanza es como el azúcar en el té; incluso cuando hay muy poco ,  hará que todo sea más dulce"
t'ipanawan allinta mantunniykita t´ipay,asegura tu mantita con el prendedor
"sasan wak runakunaq llallisqanpi kusi tariyqa ,  ichaqa ancha kusikuyta llalliy apamunman","no es fácil encontrar satisfacción en las victorias de otras personas ,  pero puede brindar tanta alegría al ganar"
imapas mana allin yuyaymunasqaqa chinkaripullanmi,en cambio cualquier cosa sin fundamento se desvanece
mancharikuypunin imaynata runakuna wak runakunata saruspa kusisqa kanku,es impactante que las personas obtengan la satisfacción de la explotación de los demás
ashkha tullukunata mach'aypi rikurani,vi muchos huesos en una cueva
wiksa allin kayqa saphin llapan imapas allin kananpaq,el placer del estómago es la basela raíz de todo bien
"sasapunin ,  runakunaqa hatun phiñachikuykunatan panpachankuman","aunque no es fácil ,  las personas son capaces de perdonar incluso las transgresiones más graves"
qankuna yachachiq kankichis,ustedes son profesores
tintinqa wasimasinchispa sach'akunapin wiñan,la granadilla crece enredándoselos árboles vecinos
runakunaqa phiña kaspa manan waqankuchu ichaqa manchakuymantaqa,"la gente generalmente no llora cuando están molestos ,  sino cuando están asustados"
makiypi k'irichayqa ña k'illayashanña,la herida de mi mano ya está cicatrizando
alqokunataqa washkhawanmi seq'ona,al perro se le ahorca con una soguilla
machula t'ikakunamanta moqokama purin,el anciano camina desde las flores hasta la colina
sara tarpusqanchisqa ñan ch'ichiramunqa,ya germinó el maíz que sembramos
churinchiskuna pukllan,nuestro hijos juegan
"sinchita ch'akirin ,  awkikunatachari phiñachinku","hay mucha sequía ,  seguramente han ofendidolos espíritus de los cerros"
such'iq qaranqa wirallaña,la piel de los bagres es grasosísima
puka layuq saphinqa allinmi ukhu onqoymanta hampiwananchispaq,la raíz del trébol rojo es buena para curar la tos
huk mana pagaspalla yachay ñawpaqman puriytan yanapan sapa p´unchay llakikuytataq chinkachipun,una beca proporciona oportunidades para el desarrollo del talentoelimina las preocupaciones diarias
"k'uychichay p'unchawtaqa hamunki ,  qonqaruwaqtaq","el día sábado tienes que venir ,  no vayasolvidarte"
manan imapas sasaqa kanchu,no hay nada imposible
noqa chunka watayuqña kani,yo ya tengo diez años
mana waqaychakuspalla pukllaqtinchisqa urmayusunmanmi,"si jugamos sin cuidado ,  podemos caernos"
chay sipascha wasinman phawaylla rishan,esa señorita está corriendo hacia su casa
"sumaqmi sichus ,  sapa p´unchay kawsay ,  yanqallamanta kaqninchista hatarichin","es agradable cuando ,  en el contexto de la vida cotidiana ,  algo repentinamente provoca nuestra emoción"
sutiykita ayllu sutiykitawan qhillqay,escribe tu nombreapellido
manan waylluytaqa huchapi t´ikachinachu,no permitir que el amor florezca es un pecado
manan allin warmakunaqa manan rikraypi ninriypi t'ispipayawaytaqa saqenkuchu,los niños malos no dejan de pellizcarme en los brazosen las orejas
phatasqa mankapiqa manan unuqa takyanchu,en olla rajada ya no se mantiene el agua
huk camionmi warmita sarurapun,un camión ha atropelladouna señora
surump'iwan hapisqa ñawiqa millaytan k'arakun,los ojos afectados por el surumpi arden insoportablemente
noqaqqa ishkay ususiymi kan kinsa churiykunapiwan llapanpiqa phishqa,"tengo dos hijastres hijos ,  en total son cinco hermanos"
atoq supayqa huk p'asñachatas q´oturusqa,dicen que el zorro endemoniado había engañadouna muchachita
llank´ana sapankaq kawsaynin kasqanpi churayqa kusikuypaqpunin allin kan,un equilibrio entre el trabajola vida personal es la clave de la felicidad
kay kuchunata pimanpas saqemuy,dejacualquiera este cuchillo
manan hayk´aqpas yacharanichu wak runa kusichiwananta,nunca pensé que otra persona podría hacerme tan feliz
warmikunaqa kukankuta huk llikllachapin apanku,las mujeres llevan su coca atado en una mantita
chayaramuqtiykin kusisqa kashani,estoy feliz porque llegaste
manan kusichu mana challwayuq qochaman riyqa huk larupitaq ashkha challwayuq qocha kan chayqa,no es divertido irun lago donde no hay peces cuando hay otros lagos cercanos con mucho
wakman munakuyta qhawachiyqa allin kawsayta apamuwanchis,mostrar sensibilidad hacia los demás proporciona un increíble sentido de armonía
uywa michiq llaqtakunaqa paqucha qarata mast'aykuspa samachisunki,en las comunidades ganaderas te alojan en tendido de cueros de alpaca
truchakuna mayupi kashan,hay truchas en el río
taytay mamaypiwan llank'anku,mi papácon mi mamá trabajan
haciendapi capatasconaqa llullakunan kasqaku,los capataces de las haciendas eran unos mentirosos
mana puriyta yachanchu,no sabe caminar
peruq hatun kusi raymin,la fiesta del perú/día de la independencia
papay chay aqata upyaykuy,"papá ,  tomate esa chicha"
pusaq killayuq wawaqa lat'akachanñan,los bebés de ocho meses ya gatean
chumpiq watuntaqa tawa q'aytumantan utaq aswan mas ashkhamantapas q'eshwakunmi,los pasadores de las fajas pueden trenzarse de cuatrode más hilos
"adobekunatan ruwasharani ,  paran hark'aruwan","estuve haciendo adobes ,  la lluvia nos ha entorpecido"
qankuna illapachay p'unchaw rimankichis,ustedes hablan el jueves
washwaqa manan unutaqa manchakunchu,el pato no tiene miedolas aguas
millay yuyay nini wayllusqayki runapi mana sonqota churaymi,el peor sentimiento que puedo imaginar es no confiar en la persona que más amas en el mundo
"sapa wata ,  ashkha runakuna qhopo onqoymanta wañunku manan qolqenku hampichikunankupaq kanchu","cada año ,  másmás personas mueren de tumores porque carecen de los recursos financieros para el tratamiento"
"hawa runakunaq karrunkuna urmayusqan qhepamanqa ,  runakunaq qapariyninmi uyarikuran","después de la catástrofe de autobuses turísticos ,  se podían escuchar los gritos de las víctimas"
sara qarpanapaqqa yarqhanta unuta pusamusunchis,conduciremos el agua por canales para regar la chacra de maíz
q'oya ichhuqa unuyuq aqokunapi allinta wiñan,la paja de la variedad coya se produce en los lugares húmedos
juanpa wasinpi huk erqe sapa p´unchay waqan,en la casa de juan hay un niño que llora todo los días
"toqti erqekunapi musphayqa ,  khuyaypunin",pensar en niños que están enfermos de malnutrición es verdaderamente deprimente
huk tawa k'uchuqa tawa k'uchuyuqmi,un cuadrado tiene cuatro lados
wawaqa wiñashanmi,el niño va creciendo
kay q'aytuta ishkay ishkaymanta kuruy,ovíllame este hilo poniéndolo de dos
sara sarapi tuparanchis,nos encontramos en el maiza
chay wallpata caldopaq phurucharusaq,pelaré esa gallina para el caldo
wirta ukhupin wiñapupaq sarataqa p'ampamuni,en el jardín tapé maíz para la jora
nisqanmanhina,de acuerdolo que dice
noqa wawqeywan pukllani,yo juego con mi hermano
"waraqoq khishkan chakiyman haykuruwan ,  ama hina kaspa orqorukuway",una espina del cactus se me ha introducido en el pie .  por favor extráemelo
paymi maqawaran,él me pegó
qhelqay imayna rimayniykikunata,escribe tus argumentos
mamaymi wayk´uyta yachachiwan,mi mamá me enseñacocinar
pisi kachiyuq kisuqa p'oshquyanmi,el queso preparado con poca sal se avinagra
kaypiqa nishutan chirin,aquí hace mucho frío
mikhunata khuchiman wikch'uykuy,tirale comida al chancho !
qella warmakunaqa millayllatañan seq'eta ruwarusqaku,los niños ociosos hicieron dibujos feos
ñankunapi tiyaq runakuna chaka ukhupi puñunku sapa tuta,los indigentes duermen debajo de los puentes todas las noches
llaqtamanmi seqaykapunku,se fueron hacia el pueblo
llapallan aylluntinmi sarata waqaychanku,toda la familia está entrojando el maíz
"manan qhepata kutiyta atikunñachu ,  ichaqa allin ñawpaqman puriytan tarina","ya que es imposible volver atrás ,  se debe encontrar la mejor manera de seguir adelante"
mana kachiyuq lecheqa miskhk'illañan,la leche sin sal es muy rico
asnuyki qaparqachayshan,tú burro está rebuznando
unuqa ancha allinmi kurpunchispaq hinallataq qhalilla kananchispaq,el agua en buenosaludable para nuestro cuerpo
muyu muyu wayraqa hallp´ata huqarispa q'oshñitaraq hatarichin,el remolino levantando la tierra produce polvo
maqaytan munawanchis,nos quieren pegar
ayataqa nishuta waqayuspan aparqapunku,llorando mucho se llevaron al cadáver
hatun mankaman hich'ay unuta hinaspa astawan apamuy,"vacía el aguala olla grande ,  luego trae más agua"
"sichus pipas llipsi nispa waqhasunki ,  yanqallamanta kallpayki ñawpaqman lloqsiyta chinkachinki","cuando alguien te llama débil ,  de repente pierdes fuerzaentusiasmo para continuar la lucha contra la adversidad"
phiña papallata mikhunki chayqa wiksaykin qolqolyan,"si comes solamente papa amarga ,  te suelta el estómago"
puna runakunaqa llama kunkamanta husut´ayuqmi puriranku,los pobladores de las punas solían caminar con sandalias hechos de cuero del cuello de las llamas
¿ pitaq chay t'ikakunatari t´iraran ?,quién arrancó esas flores ?
imaymanatan llapan atisqayta ruwashani mana nishuta oqllarunaypaq,estoy haciendo todo lo que puedo para no abrazarlo muy fuerte
kuchuna,cuchillo
huk'ucha,ratón
chinkakuq,fugitivo
muchuy,miseria
yawarchasqa,ensangrentado
k'irisqa,herido
kanasqa,quemado
huchasqa,sentencia
amaru,serpiente
añas,zorrino
apasanka,tarántula
siphiyay,penumbra
chhullunku,escarcha
ch'oque,lechuza
apu,cerro sagrado
chakata,cruz
waka,vaca
michiq,pastor
qasa,helada
sasachaykuna,problemas
ñawrayupa,matematica
onqoykuna,enfermedades
warmiyuq,casado
suwa,ladron
aya,cadaver
wañuchinapaq hampi,veneno
runa sipiq,asesino
qolqe,dinero
chakachikuy,"atorarse ,  ahogarse"
hucha,pecado
chuchu,duro
wañuy,morir
yawar,sangre
chhapchiy,sacudir
ashkha,harto
khatatatay,tiembla
khishka,espina
aqo-aqo,arenal
k'uchunay,arrinconar
t'oqona,"perforador ,  alizna"
chakitaklla,chaquitaclla
wirayay,engordar
chay runa karunchakushan,ese hombre se está alejando
kachamuwaran willanaypaq,me envió para avisarle
wasiymanta lloqsimurani,salí de mi casa
mamayki waqyamushasunki,tú mamá te está llamando
kukuchikuna runakunata manchachin,los fantasmas asustanla gente
ama maqawaychu,no me pegues
taytaykimansi willanki,dice que avisestu papá
pablopiwanmi hamusqa,había venido con pablo
qanpas hamunaykin,tú también debes de venir
institutopi yachaqaqkunaqa tocaspan takinku,los alumnos del instituto cantan tocando
maqaytan munawanchis,nos quieren pegar
nishu phuyusqa kashan,está muy nublado
ashkha tullukunata mach'aypi rikurani,vi muchos huesos en una cueva
mana uyariykichu,no te escucho
chiri wayra wayramushan,un viento frío está soplando
qayna p´unchaw chayamuran,ayer llegó
mana chay runata reqsinichu,no reconozcoese hombre
pay ashkha qolqeyuq,él tiene mucho dinero
paywanmi qhatuna wasipi tuparani,me encontré con él en el mercado
michi q'onchalawpi puñushan,el gato está durmiendo al lado del fogón
paykuna qhawaranku,ellas miraron
puñuq masiyki wañurapun,con quien duermes se ha muerto
"pedro ,  chay runata qhaway","pedro ,  mira esa persona"
paqarinmi k´ita qowi hap'iq risunchis,mañana iremoscazar cuyes silvestres
uywakunataqa warak´awanmi michina,el ganado siempre se pastorea utilizando la honda
mana allinta samaspaqa apurayllan wañurapunchisman,si no respiramos aire podemos morir en menos de un minuto
kawallupi sillakuqtiymi chakaykuna susunkharapun,cuando cabalgo se me adormecen las piernas
chaka tulluymi nanawan͘,me duele el ilşaco
raqra mankamantaqa sut'u sut'upin leche tukurakapun,de la olla rajada gotagota se ha terminado la leche
paqarinmi chay mawk'a wasita thuñichisun,mañana derribaremos esa casa vieja
"huk k'amikuymi kan ""toqro uma""","hay un insulto que dice “cabeza de calabaza"""
may hawapipas rumiqa kallanpuni,en cualquier lugar siempre hay piedras
sasachakuypin kashani,tengo un problema
qanqa wañuy patanpin kashanki,usted está en peligro de muerte
llapayku manchakuyku,todos le tenemos miedo
ayatan tariruyku,encontramos un cadáver
kayllanpin yawar kashan,hay sangre cerca
kinsamantan suwaruwanku,me asaltaron entre tres
suwaqa kuchunantinmi kasqa,el ladrón tenía un cuchillo
alqoqa waqtawanmi chakarachikusqa,el perro se había atorado con una costilla
k'iriyki kaqmanta kicharirukun,mi herida volvióabrirse
uña alqoypa mamanqa wañurapunmi,la madre de mi perrito se murió
"k'uychichay p'unchawtaqa hamunki ,  qonqaruwaqtaq","el día sábado tienes que venir ,  no vayasolvidarte"
akatanqaqa tarpuy wichaypin rikhurimun,el escarabajo reaparece abunda en épocas de sembrío
"watukuq runatataq allqu hap'irunman ,  ¡amachay !","cuidado que el perro muerda al visitante ,  ¡defiéndelo !"
¡wasiyta nina ruphashan yanapawaychis !,"¡ayudenme ,  mi casa se esta encendiando !"
usqulluqa tutan wasikunata wallpa suwakuq rin,el gato montés va de nochelas casasrobar gallinas
"wawatataq chirirunman ,  llikllawan p´istuy","pueda ser que este niño se resfríe ,  ¡envuélvelo con la manta !"
maqt'a taripaptinsi p'asñaqa rumiwan ch'aqikamun,la muchacha empezóapedrear al mozo en cuanto lo alcanzó
chiri hawas mikhuyqa ch'unchullninchista khipuchin,las comidas frías de habas producen oclusión intestinal
"sinchita ch'akirin ,  awkikunatach ari phiñachinku","hay mucha sequía ,  seguramente han ofendidolos espíritus de los cerros"
"allinta chiwchita qhawaychis ,  ankataq aparunman",¡cuíden bienlos pollitos !  no vayallevárselos el águila !
"hanaq pachaqa wichaypi ,  nina rawraqtaq uraypi",el cielo está arribael “inįerno” está abajo
t'ipanawan llikllaykita allinta hap'ichiy,asegura tu mantita con el prendedor
thoqayniymi haya ima llakichá hap'iwanqa,tengo la saliva amarga͗ qué preocupaciones tendré
wawaqa ruphaypi puñurusqa kunanqa ruphapakuycha hap'irunqa,"la niña se había dormido en el sol , ahora tiene una alta įebre"
mana hampisqa k'irinchisqa qhellimanta q'eyachan,en una herida sin curarcon suciedad seguro ha de formarse pus
ch'isi tutan yachay wasipa qhawanankunata p'akirusqaku,anoche habían roto los vidrios de la institución educativa
ninkun huk qella maqt'atas usa tukurapusqa,cuentan queun joven ocioso se lo comieron los piojos
¡alqoykita qatiy !  runatataq kanirunman,¡aleja tu perro !  no vayaser que muerdala gente
kiha churaqmi hamuni,he venido para poner una denuncia /queja
wallawan rimayta munani,deseo hablar con el policía
wawaqa hamp'atu hinaraqmi urmaykamun,el bebé se cayó como un sapo
leqleqaqa atoqta rikuspas anchata waqan,dicen que el ave centinela grita cuando ve al zorro
huklawkunapiqa wakakunaqa lachu mikhusqa qochaman haykunku,en algunos lugares las vacas entranlas lagunascomer llacho
wik´uñaqa alqotas p'itaspa llallin,la vicuña le gana en correr al perro
q'ala chakillan rumi ruminta puriyta manchakuni,siento miedo de caminar descalzo por una vía pedregoza
chay yawarniyki wañusqaqa chika chikallanmantan chinkapunqa,ese tu coágulo de sangre desaparecerá pocopoco
¡imacha chay wasiqa !,¡qué será esa habitación !
"¡imatataq millayta ch'aqwanki ,  manachu runatapas manchakunki !",¡qué feo discutes !  ¡no tienes ni miedola gente !
¿ hak´ataq katitu ac tupun ?,¿ cuánto mide el cateto ac ?
ch'usiq qapariptinqa ima llakipas kallanpunim,"si ulula la lechuza ,  es señal de mal augurio"
mana waqaychakuspalla pukllaqtinchisqa urmayusunmanmi,"si jugamos sin cuidado ,  podemos caernos"
kay pachapiqa tukuy imapas kuyunmi,"en este mundo ,  todo se mueve"
manan allinchu kanman tutakuna puriyqa,no es aconsejable caminar en las noches oscuras
taytaymi makiyman huk challwata churaykamun,mi padre puso un pez en mis manos
wakin t'oqokunaqa nishu ukhun,algunas cavernas son muy profundas
warmakunaqa tutayaypi puriytan anchata manchakunku,los niños tienen mucho miedo de caminar en la oscuridad
orqo patakunaqa phuyusqallapunin kashan,la cima de los cerros casi siempre está cubierta de neblina
tarukaqa ñawin kichasqallan puñun,el venado duerme con los ojos abiertos
qespiqa chunkaman p'akisqan rikhurirun,el espejo apareció quebrado en diez pedazos
tukulla chay chaypi tuta puñun,sólo el buho duerme por ahí
noqaykuqa hampi qorakunallawanmi hampikurayku,nosotros nos curábamos solamente con hierbas
llapallankun llaqtaman rishanku,todos están yendo al pueblo
chay erqekunaqa qaraywa hinan kumparayasharanku,esos dos niños estaban echados como lagartos
wayra muyuqa manan khaynaqa kay llaqtapiqa kanchu,el viento remolino no es común en estos pueblos
yaqa huk killañan onqoywan kashani,hace ya más de un mes que estoy enfermo
uturunkuqa sach'akunamanpas siqanmi,el jaguar trepa los árboles
nina rawrayqa ukhu pachapin,el “infierno” está abajo
wakamayuqa runa hinan qatipakuspa rimarin,el papagayo imita hablar casi como otras personas
runaqa wamp'upi huk llaqtamanta wak llaqtaman rin,la gente se traslada de un pueblootro en botes
kay uywaqa mana ashka millmayuqmi,este animal tiene poca lana
camionqa runakunantinmi qaqaman pasaykun,el camión se cayó con sus pasajeros al río
wik'uñaqa pacha mamaq uywanmi,la vicuña es el ganado de la madre tierra
mamayqa makiypi t'ipi t'ipillan awayta yachachiwan,mi madre me enseñótejer pelizcándome en las manos
kay llank'ayqa kikin yawarninchismi,este es el trabajo de nuestra sangre
chayaqtiykuqa ñan pampapiña kashasqa,cuando llegamos ya estaban en el piso
runaqa anchatan mancharikun,el hombre se asustó demasiado
alqoqa kanikuspan tuta runata muyurin,el perro rodea al ganado ladrando cada noche
chay p'ukutaqa alqon llaqwasharan,el perro estaba lamiendo ese plato
titi misiqa ch'umpi oqe,el gato montés es de color café plomizo
imapas mana allin yuyaymunasqaqa chinkaripullanmi,en cambio cualquier cosa sin fundamento se desvanece
allin cimentasqa wasiqa manan urmaykunchu,las casas con buena cimentación no se derrumban
hatun p´uyñukunan kashanman,puede haber tinajas grandes
chay pomochapi hampitaqa aytirispan upyana,la medicina de ese pomito hay que tomarla agitándola
alqo hamuqtinqa rumiwan p'ananki,si viene el perro le arrojas con piedras
chay suwa wallpaqa choqllotan t'oqpirusqa,esa gallina ladrona había picoteado el choclo
kay uraskamachu ch'achara umantin kanki,hasta estas horas estás con el cabello desgreñado
¿ maypitaq tiyan chay ch'aska ñawi sipasri ?,¿ dónde vive esa señorita de pestañas erizadas ?
qoritaqa mayupi aqopin aytispan tarikun,el oro en polvo se consigue relavando la arena de los ríos
tuyaykuytaqa kikillanmi wakaqa wasiman kutipun,al anochecer el ganado de por sí retornala casa
sipasqa sapallansi ch'ukllanmanta chitanta qhawan,dicen que la muchacha sola velaba sus ovejas desde su choza
p'achapi ch'iyataqa t'impuchispan wañuchina,las liendres se matan hirviendo la ropa infestada
nak'asqa wallpaq kunkanmanta yawarqa ch'ikllimuran,la sangre de la gallina degollada saleborbotones
mana allin allwisqa llikllaqa ch'ullpasapam lloqsin,las mantas mal urdidas salen con las esquinas disparejas
¿ maypitaq unucha kanman ?,¿ dónde habrá agua ?
noqaqa kani kiswar pampa ayllumanta͘,yo soy de la comunidad de kishuar pampa
"runaqa ch'uyapi kawsakuna ,  mana piwan cheqninakuspa",la gente debe vivir limpia de toda culpasin odio
chay alqoykiqa wak t'oqomanmi uñankunata astarqusqa͘,esa tu perra habşa trasladado sus crşasotra madriőuera
hamak'uqa uywakunaq yawarninta ch'unqaspa tulluyachin,la garrapata enflaquecelos animales chupándoles la sangre
mana pichasqa wasipi tiyaq wallpaq k'akaranpiqa yanaraq ithapas tiyaykusqa,en la cresta de las gallinas que viven en casas sucias se alojan muchos pulgones
wawakunaqa abejaq mishk'intan orqomunku,los niños recogen miel de abeja de los panales
misk'i yawarniyuq runakunas llakuntaqa q'aymallataraq mikhunanku,los diabéticos deben consumir llacón no muy maduro
tunas raphipi tiyaq uruchawanqa ñawray puka llimp'ikunata tullpunku,con el insecto de la tuna llamado cochinilla se tiñe toda la gama del rojo
yawarta thoqaq runaqa tisi onqoywanmi kashan,la persona que al toser esputa sangre seguro que tiene la tuberculosis
q'ayma yawarniyuq runaqa sut'illa q'ello q'ello uyayuq,la gente anémica es fácil de reconocerla .  ellos tienen la cara de color amarillento
chay runaqa yawar masiymi,esa persona es mi pariente
atoq supayqa huk p'asñachatas q´oturusqa,dicen que el zorro endemoniado había engañadouna muchachita
